ID,topic,subtopic,Category,level,Hours,content,glossary,content (es)
19.1.IM1,19,19.1,International-mindedness,HL,,Many electrochemical cells can act as energy sources alleviating the world’s energy problems but some cells such as super-efficient microbial fuel cells (MFCs) (also termed biological fuel cells) can contribute to clean-up of the environment. How do national governments and the international community decide on research priorities for funding purposes?,Electrochemical cells,"Muchas celdas electroquímicas pueden actuar como fuentes de energía y así paliar los problemas energéticos del mundo, pero algunas como la pila súper eficiente de combustible microbiano (PCM, también llamada pila de combustible biológico) puede contribuir a mantener limpio el ambiente. ¿De qué forma los gobiernos nacionales y la comunidad internacional establecen prioridades para la financiación de las investigaciones?"
19.1.ToK1,19,19.1,Theory of Knowledge,HL,,The SHE is an example of an arbitrary reference. Would our scientific knowledge be the same if we chose different references?,,El EEH constituye un ejemplo de referencia arbitraria. ¿Sería diferente nuestro conocimiento científico si eligiéramos referencias distintas?
19.1.Uz1,19,19.1,Utilization,HL,,Electroplating.,Electroplating,Electrodeposición.
19.1.Uz2,19,19.1,Utilization,HL,,Electrochemical processes in dentistry,Electrochemical cells,Procesos electroquímicos en odontología.
19.1.Uz3,19,19.1,Utilization,HL,,Rusting of metals.,,Corrosión de los metales.
19.1.Aims1,19,19.1,Aims,HL,,"Aim 8: Biological fuel cells can produce electrical energy to power electrical devices, houses, factories etc. They can assist in environmental clean-up. Microbial fuel cells (MFCs) powered by microbes in sewage can clean up sewage which may result in cost-free waste water treatment.",,"Objetivo 8: Las pilas de combustible biológico pueden producir energía eléctrica para alimentar aparatos eléctricos, casas, fábricas, etc. Pueden ayudar a mantener limpio el ambiente. Las pilas de combustible microbiano (PCM) alimentadas por los microbios de los desechos pueden limpiar los desechos y como resultado se podría realizar el tratamiento de aguas residuales sin costo alguno."
20.1.NoS1,20,20.1,Nature of Science,HL,,"Looking for trends and discrepancies—by understanding different types of organic reactions and their mechanisms, it is possible to synthesize new compounds with novel properties which can then be used in several applications. Organic reaction types fall into a number of different categories. (3.1)",,Buscar tendencias y discrepancias: por medio de la comprensión de los distintos tipos de reacciones orgánicas y sus mecanismos es posible sintetizar nuevos compuestos con propiedades innovadoras que se pueden usar en varias aplicaciones. Los tipos de reacciones orgánicas encajan en diferentes categorías. (3.1)
20.1.NoS2,20,20.1,Nature of Science,HL,,"Collaboration and ethical implications—scientists have collaborated to work on investigating the synthesis of new pathways and have considered the ethical and environmental implications of adopting green chemistry. (4.1, 4.5)",,"Colaboración e implicaciones éticas: los científicos han colaborado para trabajar en la investigación de nuevas rutas de síntesis y han considerado las implicaciones éticas y ambientales de adoptar una química ecológica. (4.1, 4.5)"
20.1.U1,20,20.1,Understandings,HL,,Nucleophilic Substitution Reactions: SN1 represents a nucleophilic unimolecular substitution reaction and SN2 represents a nucleophilic bimolecular substitution reaction. SN1 involves a carbocation intermediate. SN2 involves a concerted reaction with a transition state.,"Bimolecular reaction,Reaction intermediates,Transition state,Unimolecular reaction,Nucleophile,Carbocation,Steric hindrance,S<sub>N</sub>1,S<sub>N</sub>2,Nucleophilic substitution,Monomer",Reacciones de sustitución nucleófila: SN1 representa una reacción de sustitución nucleófila monomolecular y SN2 representa una reacción de sustitución nucleófila bimolecular. SN1 supone un carbocatión intermediario. SN2 implica una reacción concertada con un estado de transición.
20.1.U2,20,20.1,Understandings,HL,,Nucleophilic Substitution Reactions: For tertiary halogenoalkanes the predominant mechanism is SN1 and for primary halogenoalkanes it is SN2. Both mechanisms occur for secondary halogenoalkanes.,"Termination,Substitution reaction,S<sub>N</sub>1,S<sub>N</sub>2,Nucleophilic substitution,Halogenoalkane","Reacciones de sustitución nucleófila: Para los haluros de alquilo terciarios, el mecanismo predominante es SN1 y para los haluros de alquilo primarios, es el SN2. Los haluros de alquilo secundarios pueden reaccionar por medio de ambos mecanismos."
20.1.U3,20,20.1,Understandings,HL,,"Nucleophilic Substitution Reactions: The rate determining step (slow step) in an SN1 reaction depends only on the concentration of the halogenoalkane, rate = k[halogenoalkane]. For SN2, rate = k[halogenoalkane [nucleophile]. SN2 is stereospecific with an inversion of configuration at the carbon.","Rate determining step,Termination,Carbocation,Substitution reaction,Nucleophilic substitution,Inversion,Cis-trans isomerism","Reacciones de sustitución nucleófila: En una reacción SN1, la etapa que determina la velocidad (etapa lenta) depende solo de la concentración del haluro de alquilo, velocidad = k[haluro de alquilo]. Para una reacción SN2, velocidad = k[haluro de alquilo][nucleófilo]. La reacción SN2 es estereoespecífica con una inversión de la configuración en el carbocatión."
20.1.U4,20,20.1,Understandings,HL,,"Nucleophilic Substitution Reactions: SN2 reactions are best conducted using aprotic, non-polar solvents and SN1 reactions are best conducted using protic, polar solvents.","Solvent,Steric hindrance,S<sub>N</sub>1,S<sub>N</sub>2,Nucleophilic substitution,Aprotic solvents,Protic solvent","Reacciones de sustitución nucleófila: Las reacciones SN2 se producen mejor usando solventes apróticos, no polares y las reacciones SN1 se producen mejor usando solventes próticos, polares."
20.1.U5,20,20.1,Understandings,HL,,Electrophilic Addition Reactions: An electrophile is an electron-deficient species that can accept electron pairs from a nucleophile. Electrophiles are Lewis acids.,"Lewis acid,Electrophile,Electron deficient,Addition reaction,Nucleophile,Electrophilic addition",Reacciones de adición electrófila: Un electrófilo es una especie con déficit electrónico que puede aceptar pares de electrones de un nucleófilo. Los electrófilos son ácidos de Lewis.
20.1.U6,20,20.1,Understandings,HL,,Electrophilic Addition Reactions: Markovnikov’s rule can be applied to predict the major product in electrophilic addition reactions of unsymmetrical alkenes with hydrogen halides and interhalogens. The formation of the major product can be explained in terms of the relative stability of possible carbocations in the reaction mechanism.,"Electrophile,Halide ions,Addition reaction,Carbocation,Alkene,Markovnikov’s rule,Hydrogenation,Electrophilic addition,Positive Inductive Effect",Reacciones de adición electrófila: Se puede aplicar la regla de Markovnikov para predecir el producto principal de las reacciones de adición electrófila de alquenos asimétricos con haluros de hidrógeno e interhalógenos. La formación del producto principal se puede explicar en función de la estabilidad relativa de los carbocationes posibles en el mecanismo de reacción.
20.1.U7,20,20.1,Understandings,HL,,Electrophilic Substitution Reactions: Benzene is the simplest aromatic hydrocarbon compound (or arene) and has a delocalized structure of π bonds around its ring. Each carbon to carbon bond has a bond order of 1.5. Benzene is susceptible to attack by electrophiles.,"Electrophile,Aromatic,Bond order,Delocalization,Benzene ring,Termination,Substitution reaction,Hydrocarbon,Electrophilic substitution,Delocalized pi electron cloud","Reacciones de sustitución electrófila: El benceno es el hidrocarburo aromático más simple (o areno) y posee estructura deslocalizada de enlaces π alrededor de su anillo. El orden de enlace de cada enlace carbono a carbono es de 1,5. El benceno es susceptible de ser atacado por los electrófilos."
20.1.U8,20,20.1,Understandings,HL,,Reduction Reactions: Carboxylic acids can be reduced to primary alcohols (via the aldehyde). Ketones can be reduced to secondary alcohols. Typical reducing agents are lithium aluminium hydride (used to reduce carboxylic acids) and sodium borohydride,"Primary alcohol,Carboxylic acid,Alcohol,Aldehyde",Reacciones de sustitución electrófila: Los ácidos carboxílicos se pueden reducir a alcoholes primarios (pasando por el aldehído). Las cetonas se pueden reducir a alcoholes secundarios. Los agentes de reducción típicos son el hidruro de litio y aluminio (utilizado para reducir ácidos carboxílicos) y el borohidruro de sodio.
20.1.AS1,20,20.1,Applications and skills,HL,,Nucleophilic Substitution Reactions: Explanation of why hydroxide is a better nucleophile than water,"Nucleophile,Nucleophile,Nucleophilic substitution",Reacciones de sustitución nucleófila: Explicación de por qué el hidróxido es mejor agente nucleófilo que el agua.
20.1.AS2,20,20.1,Applications and skills,HL,,"Nucleophilic Substitution Reactions: Deduction of the mechanism of the nucleophilic substitution reactions of halogenoalkanes with aqueous sodium hydroxide in terms of SN1 and SN2 mechanisms. Explanation of how the rate depends on the identity of the halogen (ie the leaving group), whether the halogenoalkane is primary, secondary or tertiary and the choice of solvent.","Rate,Solvent,Termination,Substitution reaction,Nucleophilic substitution,Leaving group,Halogenoalkane","Reacciones de sustitución nucleófila: Deducción del mecanismo de reacciones de sustitución nucleófila de haluros de alquilo con hidróxido de sodio acuoso en función de los mecanismos SN1 y SN2. Explicación de la dependencia entre la velocidad y la identidad del halógeno (es decir, el grupo saliente), del tipo de haluro, primario, secundario o terciario y de la elección del solvente."
20.1.AS3,20,20.1,Applications and skills,HL,,Nucleophilic Substitution Reactions: Outline of the difference between protic and aprotic solvents.,"Nucleophile,Nucleophilic substitution,Aprotic solvents,Protic solvent",Reacciones de sustitución nucleófila: Descripción de la diferencia entre solventes próticos y apróticos.
20.1.AS4,20,20.1,Applications and skills,HL,,Electrophilic Addition Reactions: Deduction of the mechanism of the electrophilic addition reactions of alkenes with halogens/interhalogens and hydrogen halides.,"Electrophile,Addition reaction,Alkene,Hydrogenation,Conjugation (electronic)",Reacciones de adición electrófila: Deducción del mecanismo de las reacciones de adición electrófila de alquenos con halógenos/interhalógenos y haluros de hidrógeno.
20.1.AS5,20,20.1,Applications and skills,HL,,Electrophilic Substitution Reactions: Deduction of the mechanism of the nitration (electrophilic substitution) reaction of benzene (using a mixture of concentrated nitric acid and sulfuric acid).,"Electrophile,Electrophile,Electrophilic substitution,Aryl group,Nitrating mixture",Reacciones de sustitución electrófila: Deducción del mecanismo de la reacción de nitración (sustitución electrófila) del benceno (usando una mezcla de ácido nítrico y ácido sulfúrico concentrados).
20.1.AS6,20,20.1,Applications and skills,HL,,"Reduction Reactions: Writing reduction reactions of carbonyl containing compounds: aldehydes and ketones to primary and secondary alcohols and carboxylic acids to aldehydes, using suitable reducing agents.","Carbonyl group,Carboxylic acid,Aldehyde","Reacciones de reducción: Escritura de reacciones de reducción de compuestos que contengan el grupo carbonilo: aldehídos y cetonas a alcoholes primarios y secundarios y ácidos carboxílicos a alcoholes, usando los agentes reductores adecuados."
20.1.AS7,20,20.1,Applications and skills,HL,,Reduction Reactions: Conversion of nitrobenzene to phenylamine via a two-stage reaction,Phenylamine,Reacciones de reducción: Conversión del nitrobenceno en fenilamina por medio de una reacción en dos etapas.
20.1.G1,20,20.1,Guidance,HL,,Reference should be made to heterolytic fission for SN1 reactions.,"S<sub>N</sub>1,S<sub>N</sub>2,Heterolytic fission,Homolytic fission",Para las reacciones SN1 se debe hacer referencia a la ruptura heterolítica.
20.1.G2,20,20.1,Guidance,HL,,The difference between homolytic and heterolytic fission should be understood,,Se debe comprender la diferencia entre ruptura homolítica y heterolítica.
20.1.G3,20,20.1,Guidance,HL,,The difference between curly arrows and fish-hooks in reaction mechanisms should be emphasized.,"Reaction mechanism,Curly arrow",En los mecanismos de reacción se debe enfatizar la diferencia entre flechas curvas y anzuelos.
20.1.G4,20,20.1,Guidance,HL,,Use of partial charges (δ+ and δ-) and wedge-dash three-dimensional representations (using tapered bonds as shown below) should be encouraged where appropriate in explaining reaction mechanisms,Wedge-dash representation,"En la explicación de mecanismos, se debe fomentar el uso de cargas parciales (δ+ y δ-) y representaciones tridimensionales de caballete (usando enlaces con forma de huso como se muestra a continuación) donde sea apropiado."
20.1.G5,20,20.1,Guidance,HL,,"Typical conditions and reagents of all reactions should be known (eg catalysts, reducing agents, reflux etc.). However, more precise details such as specific temperatures need not be included.","Catalyst,Reflux,Reflux condenser,Condensation (a class of reaction)","Se deben saber las condiciones típicas y los reactivos de todas las reacciones (por ej. catalizadores, agentes reductores, reflujo, etc.). Sin embargo, no es necesario incluir los detalles más precisos como las temperaturas específicas."
20.1.IM1,20,20.1,International-mindedness,HL,,"What role does green and sustainable chemistry, in relation to organic chemistry, play in a global context?",,"¿Qué papel desempeñan la química ecológica y sostenible, en relación con la química orgánica en un contexto global?"
20.1.Uz1,20,20.1,Utilization,HL,,Organic synthesis plays a vital role in drug design and drug uptake in medicine and biochemistry.,Drug,La síntesis orgánica desempeña un papel fundamental en el diseño de drogas y la incorporación de drogas en medicina y bioquímica.
20.1.Uz2,20,20.1,Utilization,HL,,"Nutrition, food science and biotechnology also are underpinned by organic chemistry.",,"La química orgánica es la base de la nutrición, ciencia de los alimentos y la biotecnología."
20.1.Aims1,20,20.1,Aims,HL,,Aim 6: Three-dimensional visualization of organic compounds using molecular models could be covered.,Solvent front,Objetivo 6: Se podrían visualizar compuestos orgánicos de forma tridimensional usando modelos moleculares.
20.1.Aims2,20,20.1,Aims,HL,,"Aim 6: A range of experiments of organic synthetic reactions exploring various types of reactions and functional group interconversions could be done. Core techniques of organic chemistry could include reflux, distillation, filtration, purification (including chromatographic techniques), separations and extractions.","Chromatography,Column chromatography,Elution,Mobile phase,Retention times,Solute,Thin-layer chromatography (TLC),Stationary phase,Support,solvent extraction,Miscible liquids,Reflux,Reflux condenser,Condensation (a class of reaction),Rf values","Objetivo 6: Se podría realizar una gama de experimentos sobre reacciones de síntesis orgánicas explorando varios tipos de reacciones e interconversiones de grupos funcionales. Las técnicas básicas de química orgánica podrían incluir reflujo, destilación, filtración, purificación (incluso técnicas cromatográficas), separación y extracción."
20.1.Aims3,20,20.1,Aims,HL,,Aim 6: Synthesis (or reaction) in the laboratory of an example of a widely used drug or medicine (eg aspirin) or a household product (eg fading of tomato ketchup—electrophilic addition reaction of bromine).,Addition reaction,Objetivo 6: Síntesis (o reacción) en el laboratorio de un ejemplo de droga o medicina ampliamente usada (p. ej. aspirina) o bien un producto doméstico (p. ej. decoloración del ketchup de tomate: reacción de adición electrófila del bromo).
20.2.NoS,20,20.2,Nature of Science,HL,,"Scientific method—in synthetic design, the thinking process of the organic chemist is one which invokes retro-synthesis and the ability to think in a reverse-like manner. (1.3)",,"El método científico: en el diseño de una síntesis, el proceso de pensamiento de aquellos que se dedican a la química orgánica se relaciona con la retro-síntesis y la capacidad de pensar de forma inversa. (1.3)"
20.2.U1,20,20.2,Understandings,HL,,The synthesis of an organic compound stems from a readily available starting material via a series of discrete steps. Functional group interconversions are the basis of such synthetic routes.,"Reaction pathways,Hydrolysis,Hydration (of alkene),Functional groups,Retro-synthesis,Synthetic route",La síntesis de un compuesto orgánico comienza en los materiales de partida disponibles pasando por una serie de etapas discretas. La interconversión entre grupos funcionales es la base de tales rutas de síntesis.
20.2.U2,20,20.2,Understandings,HL,,Retro-synthesis of organic compounds.,"Reaction pathways,Retro-synthesis",Retro-síntesis de compuestos orgánicos.
20.2.AS1,20,20.2,Applications and skills,HL,,Deduction of multi-step synthetic routes given starting reagents and the product(s).,Synthetic route,Deducción de rutas de síntesis de varias etapas dados los reactivos de partida y el(los) producto(s).
20.2.G1,20,20.2,Guidance,HL,,Conversions with more than four stages will not be assessed in synthetic routes.,Synthetic route,No se evaluarán rutas de síntesis con conversiones de más de cuatro etapas.
20.2.G2,20,20.2,Guidance,HL,,Reaction types can cover any of the reactions covered in topic 10 and sub-topic 20.1.,,Los tipos de reacción pueden ser cualquiera de los tratados en el tema 10 y el subtema 20.1.
20.2.IM1,20,20.2,International-mindedness,HL,,How important are natural products to developing countries? Explore some specific examples of natural products available in developing countries which are important to the developed world.,,¿Cuál es la importancia de los productos naturales en los países en desarrollo? Explorar algunos ejemplos específicos de productos naturales disponibles en países en desarrollo que sean importantes para el mundo desarrollado.
20.2.ToK1,20,20.2,Theory of Knowledge,HL,,"A retro-synthetic approach is often used in the design of synthetic routes. What are the roles of imagination, intuition and reasoning in finding solutions to practical problems?",Synthetic route,"Con frecuencia se usa la retro-síntesis en el diseño de rutas de síntesis. ¿Cuál es el papel de la imaginación, la intuición y el razonamiento en la búsqueda de soluciones a los problemas prácticos?"
20.2.Uz1,20,20.2,Utilization,HL,,"Natural products are compounds isolated from natural sources and include taxol, mescaline and capsaicin.",,"Los productos naturales son compuestos aislados de fuentes naturales e incluyen el Taxol, la mescalina y la capsaicina."
20.2.Aims1,20,20.2,Aims,HL,,Aim 6: Multiple stage organic synthetic route series of experiments (up to a maximum of four stages).,"Enantiomer,Racemate,Racemic mixture,Synthetic route",Objetivo 6: Experimentos de series de rutas de síntesis orgánica (hasta un máximo de cuatro etapas).
20.3.NoS,20,20.3,Nature of Science,HL,,Transdisciplinary—the three-dimensional shape of an organic molecule is the foundation pillar of its structure and often its properties. Much of the human body is chiral. (4.1),"Stereoisomerism,Stereochemical formula,Chiral","Transdisciplinariedad: la forma tridimensional de una molécula orgánica es la base de su estructura y con frecuencia, de sus propiedades. Una buena parte del cuerpo humano es quiral. (4.1)"
20.3.U1,20,20.3,Understandings,HL,,"Stereoisomers are subdivided into two classes—conformational isomers, which interconvert by rotation about a σ bond and configurational isomers that interconvert only by breaking and reforming a bond.Configurational isomers are further subdivided into cis-trans and E/Z isomers and optical isomers.","Isomers,E/Z isomers,Optical isomers,Rules of priority,Asymmetric (chiral) carbon atom","Los estereoisómeros se subdividen en dos clases: los isómeros conformacionales, que se interconvierten por rotación alrededor de un enlace σ, y los isómeros configuracionales, que se interconvierten solo por ruptura y reformación de nuevos enlaces. Los isómeros configuracionales se subdividen a su vez en isómeros cis-trans y E/Z e isómeros ópticos."
20.3.U2,20,20.3,Understandings,HL,,"Cis-trans isomers can occur in alkenes or cycloalkanes (or heteroanalogues) and differ in the positions of atoms (or groups) relative to a reference plane. According to IUPAC, E/Z isomers refer to alkenes of the form R1R2C=CR3R4 (R1 ≠ R2, R3 ≠ R4) where neither R1 nor R2 need be different from R3 or R4.","Alkene,Isomers,IUPAC,E/Z isomers,Rules of priority","Los isómeros cis-trans se producen en los alquenos o cicloalcanos (o heteroanálogos) y difieren en la posición relativa de átomos (o grupos de átomos) respecto de un plano de referencia. De acuerdo con la IUPAC, los isómeros E/Z se refieren a alquenos de forma R1R2C=CR3R4 (R1≠ R2, R3≠ R4) donde no es preciso que R1 ni R2 sean diferentes de R3 o R4."
20.3.U3,20,20.3,Understandings,HL,,A chiral carbon is a carbon joined to four different atoms or groups,"Stereoisomerism,Stereochemical formula,Chiral",Un carbono quiral es un carbono unido a cuatro átomos o grupos diferentes.
20.3.U4,20,20.3,Understandings,HL,,An optically active compound can rotate the plane of polarized light as it passes through a solution of the compound. Optical isomers are enantiomers. Enantiomers are non-superimposeable mirror images of each other. Diastereomers are not mirror images of each other.,"Enantiomer,Resolution (chirality),Isomers,Optical activity,Optical isomers,Plane-polarized light,Diastereomers,Non-superimposable",Un compuesto ópticamente activo hace rotar el plano de la luz polarizada cuando pasa a través de una solución del compuesto. Los isómeros ópticos son enantiómeros. Los enantiómeros son imágenes especulares que no se pueden superponer entre sí. Los diastereoisómeros no son imágenes especulares entre sí.
20.3.U5,20,20.3,Understandings,HL,,A racemic mixture (or racemate) is a mixture of two enantiomers in equal amounts and is optically inactive.,"Enantiomer,Racemate,Racemic mixture",Una mezcla racémica (o racemato) es una mezcla de dos enantiómeros en cantidades iguales y es ópticamente inactiva.
20.3.AS1,20,20.3,Applications and skills,HL,,Construction of 3-D models (real or virtual) of a wide range of stereoisomers.,,Construcción de modelos 3D (reales o virtuales) de una gran variedad de estereoisómeros.
20.3.AS2,20,20.3,Applications and skills,HL,,Explanation of stereoisomerism in non-cyclic alkenes and C3 and C4 cycloalkanes.,"Stereoisomerism,Stereochemical formula,Alkene","Explicación de la estereoisomería en alquenos no cíclicos, y en cicloalcanos de C3 y C4."
20.3.AS3,20,20.3,Applications and skills,HL,,Have drugs and medicines in some countries been sold and administered as racemates instead of as the desired enantiomer with the associated therapeutic activity? Can you think of any drugs or medicines which may serve as good case studies for this?,"Racemate,Resolution (chirality)",Comparación entre las propiedades físicas y químicas de los enantiómeros.
20.3.AS4,20,20.3,Applications and skills,HL,,Description and explanation of optical isomers in simple organic molecules.,"Optical isomers,Stereospecific",Descripción y explicación de isómeros ópticos en moléculas orgánicas simples.
20.3.AS5,20,20.3,Applications and skills,HL,,Distinction between optical isomers using a polarimeter.,"Isomers,Polarimeter,Optical isomers,Polarizer",Diferenciación entre isómeros ópticos usando un polarímetro.
20.3.G1,20,20.3,Guidance,HL,,The term geometric isomers as recommended by IUPAC is now obsolete and cis-trans isomers and E/Z isomers should be encouraged in the teaching programme.,"Termination,Substitution reaction,IUPAC,Geometric isomerism,E/Z isomers,Stereospecific,Rules of priority","El término “isómeros geométricos”, según recomendación de la IUPAC, es obsoleto. Se recomienda su enseñanza con la denominación “isómeros cistrans” e “isómeros E/Z”."
