ID,topic,subtopic,Category,level,Hours,content,glossary,content (es)
B.6.U7,B (core),B.6,Understandings,core,,"Green chemistry, also called sustainable chemistry, is an approach to chemical research and engineering that seeks to minimize the production and release to the environment of hazardous substances.",,"La química ecológica, también llamada química sostenible, es una rama de la investigación química y la ingeniería que pretende minimizar la producción y liberación al ambiente de sustancias peligrosas."
B.6.AS1,B (core),B.6,Applications and skills,core,,Discussion of the increasing problem of xenobiotics such as antibiotics in sewage treatment plants.,,Discusión del creciente problema de los xenobióticos como los antibióticos en las plantas de tratamiento de aguas residuales.
B.6.AS2,B (core),B.6,Applications and skills,core,,Description of the role of starch in biodegradable plastics.,,Descripción del papel del almidón en los plásticos biodegradables.
B.6.AS3,B (core),B.6,Applications and skills,core,,Application of host–guest chemistry to the removal of a specific pollutant in the environment.,,Aplicación de la química host-guest para la eliminación de un contaminante específico del ambiente.
B.6.AS4,B (core),B.6,Applications and skills,core,,"Description of an example of biomagnification, including the chemical source of the substance. Examples could include heavy metals or pesticides.",,"Descripción de un ejemplo de bioamplificación, incluida la fuente química de la sustancia. Los ejemplos pueden incluir metales pesados o pesticidas."
B.6.AS5,B (core),B.6,Applications and skills,core,,"Discussion of the challenges and criteria in assessing the “greenness” of a substance used in biochemical research, including the atom economy.",,"Discusión de los desafíos y criterios para la evaluación del “ecologismo” de una sustancia usada en investigación bioquímica, incluida la eficiencia atómica."
B.6.G1,B (core),B.6,Guidance,core,,Specific names of “green chemicals” such as solvents are not expected.,,No se requieren los nombres de “sustancias químicas ecológicas” como los disolventes.
B.6.G2,B (core),B.6,Guidance,core,,The emphasis in explanations of host–guest chemistry should be on non- covalent bonding within the supramolecule.,,"En las explicaciones de química host-guest, se debe destacar el enlace no covalente dentro de la supramolécula."
B.6.IM1,B (core),B.6,International-mindedness,core,,"The term green chemistry was first coined in 1991, and acceptance of its philosophy has led to developments in education and legislation in many countries.",,"El término química ecológica fue acuñado por primera vez en 1991, y la aceptación de su filosofía ha conducido al cambio de la situación en la educación y legislación de muchos países."
B.6.IM2,B (core),B.6,International-mindedness,core,,"Use of the pesticide DDT is banned in most countries due to its toxic effects and biomagnification. Its use continues, however, in countries where malaria remains a major public health challenge.",xenobiotics,"El uso del pesticida DDT está prohibido en la mayoría de los países debido a sus efectos tóxicos y a la bioamplificación. Sin embargo, su uso continúa en países donde la malaria continúa siendo un gran reto para la salud pública."
B.6.Aims1,B (core),B.6,Aims,core,,Aim 6: Experiments could include the comparison of the breakdown of biodegradable and non-biodegradable plastics in the environment.,,Objetivo 6: Los experimentos podrían incluir la comparación de la degradación de plásticos biodegradables y no biodegradables en el ambiente.
B.6.Aims2,B (core),B.6,Aims,core,,"Aim 6: Risk assessment, including the risks to the environment, is an essential part of all experimental work.",,"Objetivo 6: La evaluación de riesgos, incluyendo los riesgos ambientales, constituye una parte fundamental de todo trabajo experimental."
B.6.Aims3,B (core),B.6,Aims,core,,Aim 8: The development of the science of green chemistry has raised awareness of the environmental and ethical implications of using science and technology.,,Objetivo 8: El desarrollo de la ciencia de la química ecológica ha aumentado la toma de conciencia de las implicaciones ambientales y éticas por el uso de la ciencia y la tecnología.
B.7.NoS1,B (HL),B.7,Nature of Science,HL,,Theories can be superseded—“lock and key” hypothesis to “induced fit” model for enzymes. (1.9),,Las teorías pueden ser sustituidas: de la hipótesis de “llave y cerradura” al modelo de “encaje inducido” para las enzimas. (1.9)
B.7.NoS2,B (HL),B.7,Nature of Science,HL,,Collaboration and ethical considerations—scientists collaborate to synthesize new enzymes and to control desired reactions (ie waste control). (4.5),,"Colaboración y consideraciones éticas: Los científicos colaboran en la síntesis de nuevas enzimas y para controlar reacciones deseadas (es decir, control de residuos). (4.5)"
B.7.U1,B (HL),B.7,Understandings,HL,,Inhibitors play an important role in regulating the activities of enzymes.,,Los inhibidores desempeñan un papel importante en la regulación de las actividades de las enzimas.
B.7.U2,B (HL),B.7,Understandings,HL,,Amino acids and proteins can act as buffers in solution.,,Los aminoácidos y las proteínas pueden actuar como tampones en solución.
B.7.U3,B (HL),B.7,Understandings,HL,,Protein assays commonly use UV-vis spectroscopy and a calibration curve based on known standards.,"Calibration,Calibration curve,Spectroscopy,Ultraviolet/visible spectroscopy,Quantitative analysis",Los ensayos de proteínas frecuentemente usan espectroscopía UV-visible y una curva de calibración basada en patrones conocidos.
B.7.AS1,B (HL),B.7,Applications and skills,HL,,"Determination of the maximum rate of reaction (Vmax) and the value of the Michaelis constant (Km) for an enzyme by graphical means, and explanation of its significance.",,"Determinación de la velocidad máxima de reacción (Vmax) y el valor de la constante de Michaelis (Km) para una enzima por medios gráficos, y explicación de su significado."
B.7.AS2,B (HL),B.7,Applications and skills,HL,,"Comparison of competitive and non-competitive inhibition of enzymes with reference to protein structure, the active site and allosteric site.",,"Comparación de la inhibición enzimática competitiva y no competitiva en cuanto a la estructura de la proteína, el sitio activo y el sitio alostérico."
B.7.AS3,B (HL),B.7,Applications and skills,HL,,Explanation of the concept of product inhibition in metabolic pathways.,,Explicación del concepto de inhibición de un producto en rutas metabólicas.
B.7.AS4,B (HL),B.7,Applications and skills,HL,,"Calculation of the pH of buffer solutions, such as those used in protein analysis and in reactions involving amino acids in solution.",,"Cálculos del pH de soluciones tampón, como las que se usan en análisis de proteínas y en reacciones con aminoácidos en solución."
B.7.AS5,B (HL),B.7,Applications and skills,HL,,Determination of the concentration of a protein in solution from a calibration curve using the Beer–Lambert law.,"Beer–Lambert Law,Calibration,Calibration curve",Determinación de la concentración de una proteína en solución a partir de una curva de calibración usando la ley de Beer-Lambert.
B.7.G1,B (HL),B.7,Guidance,HL,,The effects of competitive and non-competitive inhibitors on Km and Vmax values • should be covered.,,Se deben cubrir los efectos de los inhibidores competitivos y no competitivos sobre los valores de Km y Vmax.
B.7.G2,B (HL),B.7,Guidance,HL,,The Henderson–Hasselbalch equation is given in the data booklet in section 1.,,En la sección 1 del cuadernillo de datos se da la ecuación de Henderson- Hasselbalch.
B.7.G3,B (HL),B.7,Guidance,HL,,"For UV-vis spectroscopy, knowledge of particular reagents and wavelengths is not required.","Ultraviolet/visible spectroscopy,Quantitative analysis","Para la espectroscopía UV-visible, no se requiere conocimiento de reactivos específicos ni longitudes de onda."
B.7.IM1,B (HL),B.7,International-mindedness,HL,,Technologies based on enzyme activity go back to ancient times in many parts of the world. Brewing and cheese-making are often associated with particular place names.,,Las tecnologías basadas en la acción enzimática se remontan a tiempos antiguos en algunos países. La fabricación de cerveza y de quesos se asocian con frecuencia a nombres de lugares particulares.
B.7.ToK1,B (HL),B.7,Theory of Knowledge,HL,,The term “lock-and-key” is an effective metaphor but the “induced fit” model is a better model. How are metaphors and models used in the construction of knowledge?,,"El término “llave y cerradura” es una metáfora efectiva, pero el modelo “encaje inducido” es mejor. ¿Cómo se usan las metáforas y los modelos en la construcción del conocimiento?"
B.7.Uz1,B (HL),B.7,Utilization,HL,,"Enzymes are widely used in industrial and domestic applications. Examples include biological detergents, textiles, foods and beverages, and biodegradable plastics. Advances in protein engineering have led to the synthesis of enzymes that are effective in a wide range of conditions.",,"Las enzimas se usan ampliamente en aplicaciones industriales y domésticas. Los ejemplos incluyen detergentes biológicos, textiles, alimentos y bebidas, y plásticos biodegradables. Los avances en la ingeniería de las proteínas han conducido a la síntesis de enzimas efectivas en un amplio rango de condiciones."
B.7.Aims1,B (HL),B.7,Aims,HL,,"Aim 6: Experiments could include measuring enzyme activity with changing conditions of temperature, pH and heavy metal ion concentration.",,"Objetivo 6: Los experimentos podrían incluir medición de la actividad enzimática con la variación de las condiciones de temperatura, pH y concentración de iones de metales pesados."
B.7.Aims2,B (HL),B.7,Aims,HL,,Aim 7: Data-logging experiments with temperature or pH probes to investigate enzyme activity under different conditions; or computer modelling of enzyme– substrate interactions.,,Objetivo 7: Experimentos de registro de datos con sondas de temperatura o pH para investigar la actividad enzimática en diferentes condiciones; o simulaciones informáticas de las interacciones enzima-sustrato.
B.7.Aims3,B (HL),B.7,Aims,HL,,"Aim 8: Many enzyme technologies help mitigate damaging environmental effects of chemicals, such as from leather, paper and oil industries.",,"Objetivo 8: Muchas tecnologías enzimáticas ayudan a mitigar los efectos ambientales perjudiciales de los agentes químicos como los de las industrias del cuero, papel y petróleo."
B.8.NoS1,B (HL),B.8,Nature of Science,HL,,Scientific method—the discovery of the structure of DNA is a good example of different approaches to solving the same problem. Scientists used models and diffraction experiments to develop the structure of DNA. (1.3),,El método científico: el descubrimiento de la estructura del ADN es un buen ejemplo de utilización de diferentes enfoques para resolver el mismo problema. Los científicos usaron modelos y experimentos de difracción para desarrollar la estructura del ADN. (1.3)
B.8.NoS2,B (HL),B.8,Nature of Science,HL,,Developments in scientific research follow improvements in apparatus—double helix from X-ray diffraction provides explanation for known functions of DNA. (3.7),,Los desarrollos en investigación científica son consecuencia del perfeccionamiento de los aparatos: la doble hélice proveniente de la difracción de rayos X proporciona la explicación para las funciones conocidas del ADN. (3.7)
B.8.U1,B (HL),B.8,Understandings,HL,,"Nucleotides are the condensation products of a pentose sugar, phosphoric acid and a nitrogenous base—adenine (A), guanine (G), cytosine (C), thymine (T) or uracil (U).",,"Los nucleótidos son productos de condensación de un azúcar pentosa, ácido fosfórico y una base nitrogenada: adenina (A), guanina (G), citosina (C), timina (T) o uracilo (U)."
B.8.U2,B (HL),B.8,Understandings,HL,,Polynucleotides form by condensation reactions.,,Los polinucleótidos se forman por reacciones de condensación.
B.8.U3,B (HL),B.8,Understandings,HL,,DNA is a double helix of two polynucleotide strands held together by hydrogen bonds.,,El ADN es una doble hélice formada por dos cadenas de polinucleótidos que se mantienen juntas por uniones de hidrógeno.
B.8.U4,B (HL),B.8,Understandings,HL,,"RNA is usually a single polynucleotide chain that contains uracil in place of thymine, and a sugar ribose in place of deoxyribose.",,El ARN es generalmente una sola cadena de polinucleótido que contiene uracilo en lugar de timina y un azúcar ribosa en lugar de la desoxirribosa.
B.8.U5,B (HL),B.8,Understandings,HL,,"The sequence of bases in DNA determines the primary structure of proteins synthesized by the cell using a triplet code, known as the genetic code, which is universal.",,"La secuencia de bases del ADN determina la estructura primaria de las proteínas sintetizadas por la célula usando un código de tres bases, conocido como código genético, que es universal."
B.8.U6,B (HL),B.8,Understandings,HL,,"Genetically modified organisms have genetic material that has been altered by genetic engineering techniques, involving transferring DNA between species.",,"Los organismos modificados genéticamente tienen material genético que ha sido alterado por medio de técnicas de ingeniería genética, que implican transferencias de ADN entre especies."
B.8.AS1,B (HL),B.8,Applications and skills,HL,,Explanation of the stability of DNA in terms of the interactions between its hydrophilic and hydrophobic components.,,Explicación de la estabilidad del ADN en función de las interacciones entre sus componentes hidrofílicos e hidrofóbicos.
B.8.AS2,B (HL),B.8,Applications and skills,HL,,Explanation of the origin of the negative charge on DNA and its association with basic proteins (histones) in chromosomes.,,Explicación del origen de la carga negativa en el ADN y su asociación con las proteínas básicas de los cromosomas (histonas).
B.8.AS3,B (HL),B.8,Applications and skills,HL,,Deduction of the nucleotide sequence in a complementary strand of DNA or a molecule of RNA from a given polynucleotide sequence.,,Deducción de la secuencia de nucleótidos de una hebra complementaria de ADN o una molécula de ARN a partir de una secuencia de polinucleótido dada.
B.8.AS4,B (HL),B.8,Applications and skills,HL,,Explanation of how the complementary pairing between bases enables DNA to replicate itself exactly.,,Explicación de cómo el apareamiento complementario entre bases permite que el ADN sea capaz de replicarse a sí mismo exactamente.
B.8.AS5,B (HL),B.8,Applications and skills,HL,,Discussion of the benefits and concerns of using genetically modified foods,,Discusión de los beneficios y preocupaciones acerca del uso de alimentos modificados genéticamente.
B.8.G1,B (HL),B.8,Guidance,HL,,Structures of the nitrogenous bases and ribose and deoxyribose sugars are given in the data booklet in section 34.,,En la sección 34 del cuadernillo de datos se dan las estructuras de las bases nitrogenadas y los azúcares ribosa y desoxirribosa.
B.8.G2,B (HL),B.8,Guidance,HL,,Knowledge of the different forms of RNA is not required.,,No se requiere el conocimiento de las diferentes formas de ARN.
B.8.G3,B (HL),B.8,Guidance,HL,,Details of the process of DNA replication are not required.,,No se requieren los detalles del proceso de replicación de ADN.
B.8.G4,B (HL),B.8,Guidance,HL,,Limit expression of DNA to the concept of a four-unit base code determining a twenty-unit amino acid sequence. Details of transcription and translation are not required.,,Limitar la expresión de ADN al concepto de que un código de cuatro unidades de bases determina una secuencia de veinte unidades de aminoácidos. No se requieren detalles de la transcripción y la traducción.
B.8.IM1,B (HL),B.8,International-mindedness,HL,,The Human Genome Project was an international research programme whose goal was to complete the mapping and sequencing of all the genes in the human genome.,,El Proyecto Genoma Humano fue un programa de investigación internacional cuya meta fue completar el mapeo y secuenciación de todos los genes del genoma humano.
B.8.IM2,B (HL),B.8,International-mindedness,HL,,The policies on the labelling of genetically modified (GM) foods vary greatly in different countries.,,Las políticas de etiquetado de los alimentos modificados genéticamente (AMG) varía ampliamente en diferentes países.
B.8.IM3,B (HL),B.8,International-mindedness,HL,,Most of the genetically modified organisms are protected by international patents. What effect does this have on the global economy and scientific community?,,La mayoría de los organismos modificados genéticamente están protegidos por patentes internacionales. ¿Qué efecto tiene este hecho sobre la economía global y la comunidad científica?
B.8.ToK1,B (HL),B.8,Theory of Knowledge,HL,,DNA stores information but not knowledge.,,"El ADN almacena información, pero no conocimiento."
B.8.ToK2,B (HL),B.8,Theory of Knowledge,HL,,What are the differences between information and knowledge?,,¿Cuáles son las diferencias entre información y conocimiento?
B.8.ToK3,B (HL),B.8,Theory of Knowledge,HL,,"The Nobel Prize in Physiology or Medicine 1962 was awarded jointly to Crick, Watson and Wilkins ""for their discoveries concerning the molecular structure of nucleic acids and its significance for information transfer in living material"". What is the role of collaboration in advancing knowledge?",,"En 1962, el Premio Nobel de Fisiología o Medicina se adjudicó conjuntamente a Crick, Watson y Wilkins “por sus descubrimientos relativos a la estructura molecular de los ácidos nucleicos y su importancia para la transferencia de información en el material vivo.” ¿Cuál es el papel de la colaboración en el avance del conocimiento?"
B.8.ToK4,B (HL),B.8,Theory of Knowledge,HL,,The existence of DNA databases opens up questions of individual privacy and the extent to which government has the right of access to personal information. Who has the right to access knowledge of an individual’s DNA?,,La existencia de bases de datos de ADN plantea preguntas sobre la privacidad del individuo y el derecho que tienen los gobiernos de acceder a la información personal. ¿Quién tiene el derecho de acceder al conocimiento del ADN de una persona?
B.8.Uz1,B (HL),B.8,Utilization,HL,,"Knowledge of DNA sequencing has transformed several aspects of legal enquiry, including forensics and paternity cases. It is also widely used in studies of ancestry and human migration.",,"El conocimiento de la secuenciación de ADN ha transformado ciertos aspectos de la investigación legal, incluyendo casos forenses y de paternidad. También se usa ampliamente en estudios de datos genealógicos y migraciones humanas."
B.8.Uz2,B (HL),B.8,Utilization,HL,,DNA sequencing is an important aspect of the study of biochemical evolution.,,La secuenciación del ADN es un aspecto importante del estudio de la evolución bioquímica.
B.8.Aims1,B (HL),B.8,Aims,HL,,Aim 5: The story of the rivalry between the different teams involved in the elucidation of DNA structure in the 1950s is an example of a failure of effective collaboration and communication during scientific activities.,,Objetivo 5: La historia de la rivalidad existente entre los diferentes equipos implicados en la elucidación de la estructura del ADN en los años 50 es un ejemplo de la falta de colaboración efectiva y comunicación durante las actividades científicas.
B.8.Aims2,B (HL),B.8,Aims,HL,,"Aim 6: Experiments could include DNA extraction from cells and investigation of its physical properties, and model building exercises of DNA structure, including the specific base pairings between a purine and a pyrimidine.",,"Objetivo 6: Los experimentos podrían incluir la extracción de ADN de células e investigación de sus propiedades físicas y ejercicios de construcción de modelos de estructura de ADN, incluyendo el apareamiento específico de las bases entre purina y pirimidina."
B.8.Aims3,B (HL),B.8,Aims,HL,,Aim 7: Databases exist of genetic sequences from different organisms.,,Objetivo 7: Existen bases de datos de secuencias genéticas de diferentes organismos.
B.8.Aims4,B (HL),B.8,Aims,HL,,"Aim 8: Many ethical questions are raised by our knowledge of the human genome, including cloning, genetic engineering, gene therapy, and so on.",,"Objetivo 8: Muchas cuestiones éticas se derivan de nuestro conocimiento del genoma humano, incluyendo la clonación, la ingeniería genética y la terapia genética, entre otras."
B.9.NoS,B (HL),B.9,Nature of Science,HL,,"Use of data—quantitative measurements of absorbance are a reliable means of communicating data based on colour, which was previously subjective and difficult to replicate. (3.1)",Absorption spectrum (experimental),Uso de datos: las mediciones cuantitativas de absorbancia constituyen un medio fiable de comunicar bases de datos de colores que inicialmente eran subjetivas y difíciles de duplicar. (3.1)
B.9.U1,B (HL),B.9,Understandings,HL,,Biological pigments are coloured compounds produced by metabolism.,,Los pigmentos biológicos son compuestos coloreados producidos por el metabolismo.
B.9.U2,B (HL),B.9,Understandings,HL,,"The colour of pigments is due to highly conjugated systems with delocalized electrons, which have intense absorption bands in the visible region.",Absorption spectrum (experimental),"El color de los pigmentos se debe a sus sistemas altamente conjugados con electrones deslocalizados, que presentan intensas bandas de absorción en la región visible."
B.9.U3,B (HL),B.9,Understandings,HL,,"Porphyrin compounds, such as hemoglobin, myoglobin, chlorophyll and many cytochromes are chelates of metals with large nitrogen-containing macrocyclic ligands.",,"Las porfirinas, como la hemoglobina, la mioglobina, la clorofila y muchos citocromos, son quelatos de metales con grandes ligandos macrocíclicos que contienen nitrógeno."
B.9.U4,B (HL),B.9,Understandings,HL,,Hemoglobin and myoglobin contain heme groups with the porphyrin group bound to an iron(II) ion.,,La hemoglobina y la mioglobina contienen grupos hemo en el que el grupo porfirina está enlazado a un ion hierro (II).
B.9.U5,B (HL),B.9,Understandings,HL,,Cytochromes contain heme groups in which the iron ion interconverts between iron(II) and iron(III) during redox reactions.,,Los citocromos contienen grupos hemo en los que el ion hierro se interconvierte de hierro (II) a hierro (III) durante reacciones rédox.
B.9.U6,B (HL),B.9,Understandings,HL,,"Anthocyanins are aromatic, water-soluble pigments widely distributed in plants. Their specific colour depends on metal ions and pH.",,Las antocianinas son pigmentos aromáticos solubles en agua extensamente distribuidos en las plantas. Su color específico depende de los iones metálicos y del pH.
B.9.U7,B (HL),B.9,Understandings,HL,,"Carotenoids are lipid-soluble pigments, and are involved in harvesting light in photosynthesis. They are susceptible to oxidation, catalysed by light.",,Los carotenoides son pigmentos solubles en lípidos y están involucrados en la captación de luz durante la fotosíntesis. Son susceptibles de oxidación catalizada por la luz.
B.9.AS1,B (HL),B.9,Applications and skills,HL,,Explanation of the sigmoidal shape of hemoglobin’s oxygen dissociation curve in terms of the cooperative binding of hemoglobin to oxygen.,,Explicación de la forma sigmoidal de la curva de disociación del oxígeno de la hemoglobina en función del enlace cooperativo de la hemoglobina con el oxígeno.
B.9.AS2,B (HL),B.9,Applications and skills,HL,,"Discussion of the factors that influence oxygen saturation of hemoglobin, including temperature, pH and carbon dioxide.",,"Discusión de los factores que influyen sobre la saturación de oxígeno de la hemoglobina, incluidos la temperatura, el pH y el dióxido de carbono."
B.9.AS3,B (HL),B.9,Applications and skills,HL,,Description of the greater affinity of oxygen for foetal hemoglobin.,,Descripción de la mayor afinidad por el oxígeno de la hemoglobina fetal.
B.9.AS4,B (HL),B.9,Applications and skills,HL,,Explanation of the action of carbon monoxide as a competitive inhibitor of oxygen binding.,,Explicación de la acción del monóxido de carbono como inhibidor competitivo de la unión con el oxígeno.
B.9.AS5,B (HL),B.9,Applications and skills,HL,,"Outline of the factors that affect the stabilities of anthocyanins, carotenoids and chlorophyll in relation to their structures.",,"Resumen de los factores que afectan la estabilidad de las antocianinas, los carotenoides y la clorofila en función de sus estructuras."
B.9.AS6,B (HL),B.9,Applications and skills,HL,,Explanation of the ability of anthocyanins to act as indicators based on their sensitivity to pH.,,Explicación de la capacidad de las antocianinas de actuar como indicadores basándose en su sensibilidad al pH.
B.9.AS7,B (HL),B.9,Applications and skills,HL,,Description of the function of photosynthetic pigments in trapping light energy during photosynthesis.,,Descripción de capacidad de los pigmentos fotosintéticos de capturar energía solar durante la fotosíntesis.
B.9.AS8,B (HL),B.9,Applications and skills,HL,,Investigation of pigments through paper and thin layer chromatography.,"Chromatography,Elution,Mobile phase,Retention times,Solute,Retention factor,Stationary phase,Support",Investigación de pigmentos por medio de cromatografía en papel y en capa delgada.
