ID,topic,subtopic,Category,level,Hours,content,glossary,content (es)
9.1.IM1,9,9.1,International-mindedness,core,,"Access to a supply of clean drinking water has been recognized by the United Nations as a fundamental human right, yet it is estimated that over one billion people lack this provision. Disinfection of water supplies commonly uses oxidizing agents such as chlorine or ozone to kill microbial pathogens.","Ozone,Ozone depletion,Ozone layer","Naciones Unidas ha reconocido el acceso al abastecimiento de agua potable limpia como un derecho humano fundamental, sin embargo se estima que más de mil millones de personas carecen de dicho suministro. Para la desinfección de los abastecimientos de agua, generalmente se utilizan agentes oxidantes tales como el cloro o el ozono que eliminan los microbios patógenos."
9.1.ToK1,9,9.1,Theory of Knowledge,core,,Chemistry has developed a systematic language that has resulted in older names becoming obsolete. What has been lost and gained in this process?,,La química ha desarrollado un lenguaje sistemático que trajo como consecuencia que los nombres antiguos resulten obsoletos. ¿Qué se ha perdido y qué se ha ganado en este proceso?
9.1.ToK2,9,9.1,Theory of Knowledge,core,,Oxidation states are useful when explaining redox reactions. Are artificial conversions a useful or valid way of clarifying knowledge?,,Los estados de oxidación son útiles para explicar las reacciones rédox. ¿Son las conversiones artificiales una forma útil o válida de esclarecer el conocimiento?
9.1.Uz1,9,9.1,Utilization,core,,"Aerobic respiration, batteries, solar cells, fuel cells, bleaching by hydrogen peroxide of melanin in hair, household bleach, the browning of food exposed to air, etc.",Bleach,"Respiración aeróbica, baterías, células solares, pilas de combustible, decoloración de la melanina del cabello con peróxido de hidrógeno, lejía doméstica, el pardeamiento de los alimentos por exposición al aire, etc."
9.1.Uz2,9,9.1,Utilization,core,,Driving under the influence of alcohol is a global problem which results in serious road accidents. A redox reaction is the basis of the breathalyser test.,Quantitative analysis,La conducción bajo los efectos del alcohol es un problema global que tiene como consecuencia serios accidentes de carretera. Una reacción rédox es la base de la prueba del alcoholímetro.
9.1.Uz3,9,9.1,Utilization,core,,Natural and synthetic antioxidants in food chemistry.,,Antioxidantes naturales y sintéticos en la química de los alimentos.
9.1.Uz4,9,9.1,Utilization,core,,Photochromic lenses.,,Lentes fotocromáticos.
9.1.Uz5,9,9.1,Utilization,core,,Corrosion and galvanization.,Galvanized iron,Corrosión y galvanización.
9.1.Aims1,9,9.1,Aims,core,,"Aim 6: Experiments could include demonstrating the activity series, redox titrations, and using the Winkler method to measure BOD.","Redox titration,Eutrophication,Winkler method","Objetivo 6: Los experimentos podrían incluir la demostración de la serie de actividades, titulaciones rédox, y el uso del método de Winkler para medir la DBO."
9.1.Aims2,9,9.1,Aims,core,,Aim 8: Oxidizing agents such as chlorine can be used as disinfectants. Use of chlorine as a disinfectant is of concern due to its ability to oxidize other species forming harmful by-products (eg trichloromethane).,By-products,Objetivo 8: Los agentes oxidantes como el cloro se pueden usar como desinfectantes. El uso de cloro como desinfectante es una preocupación debido a su capacidad de oxidar otras especies formando subproductos dañinos (p. ej. triclorometano).
9.2.NoS,9,9.2,Nature of Science,core,,Ethical implications of research—the desire to produce energy can be driven by social needs or profit. (4.5),,Implicaciones éticas de la investigación: El deseo de producir energía puede estar determinado por necesidades sociales o beneficios económicos. (4.5)
9.2.U1,9,9.2,Understandings,core,,"Voltaic cells convert energy from spontaneous, exothermic chemical processes to electrical energy.","Voltmeter,Voltaic cell,Volt,Spontaneous reaction",Las pilas voltaicas convierten la energía de procesos químicos espontáneos y exotérmicos en energía eléctrica.
9.2.U2,9,9.2,Understandings,core,,Oxidation occurs at the anode (negative electrode) and reduction occurs at the cathode (positive electrode) in a voltaic cell.,"Anode,Cathode,Voltaic cell,Electrode,Volt","En una pila voltaica, la oxidación se produce en el ánodo (electrodo negativo) y la reducción en el cátodo (electrodo positivo)."
9.2.U3,9,9.2,Understandings,core,,"Electrolytic cells convert electrical energy to chemical energy, by bringing about non-spontaneous processes.",Electrolytic cells,"Las celdas electrolíticas convierten energía eléctrica en energía química, y dan lugar así a procesos no espontáneos."
9.2.U4,9,9.2,Understandings,core,,Oxidation occurs at the anode (positive electrode) and reduction occurs at the cathode (negative electrode) in an electrolytic cell.,"Anode,Cathode,Electrode,Electrolytic cells","En una celda electrolítica, la oxidación se produce en el ánodo (electrodo positivo) y la reducción se produce en el cátodo (electrodo negativo)."
9.2.AS1,9,9.2,Applications and skills,core,,Construction and annotation of both types of electrochemical cells.,"Voltmeter,Voltaic cell,Electrochemical cells,Salt bridge",Construcción y anotación de ambos tipos de celdas electroquímicas.
9.2.AS2,9,9.2,Applications and skills,core,,Explanation of how a redox reaction is used to produce electricity in a voltaic cell and how current is conducted in an electrolytic cell.,"Voltmeter,Voltaic cell,Salt bridge,Ampere,Current,Electrolytic cells,Volt",Explicación de cómo se usa una reacción rédox para producir electricidad en una pila voltaica y cómo se conduce la corriente en una celda electrolítica.
9.2.AS3,9,9.2,Applications and skills,core,,Distinction between electron and ion flow in both electrochemical cells.,"Voltmeter,Voltaic cell,Electrochemical cells,Salt bridge,Volt",Diferencia entre flujo electrónico y flujo iónico en ambas celdas electroquímicas.
9.2.AS4,9,9.2,Applications and skills,core,,Performance of laboratory experiments involving a typical voltaic cell using two metal/metal-ion half-cells.,"Voltmeter,Voltaic cell,Salt bridge,Standard half-cell,Volt,Half-cells",Realización de experimentos de laboratorio con pilas voltaicas típicas usando dos semiceldas de metal/ion metálico.
9.2.AS5,9,9.2,Applications and skills,core,,Deduction of the products of the electrolysis of a molten salt.,Molten salts,Deducción de los productos de la electrólisis de una sal fundida.
9.2.G1,9,9.2,Guidance,core,,"For voltaic cells, a cell diagram convention should be covered.","Voltmeter,Voltaic cell,Salt bridge,Cell diagram,Volt",Se debe tratar el diagrama convencional que se usa para representar pilas voltaicas.
9.2.IM1,9,9.2,International-mindedness,core,,"Research in space exploration often centres on energy factors. The basic hydrogen–oxygen fuel cell can be used as an energy source in spacecraft, such as those first engineered by NASA in the USA. The International Space Station is a good example of a multinational project involving the international scientific community.",,"La investigación en exploración espacial con frecuencia se centra en factores energéticos. La pila básica de hidrógeno-oxígeno se puede usar como fuente de energía en las naves espaciales, como las primeras construidas por la NASA en los EE. UU. La Estación Espacial Internacional constituye un buen ejemplo de proyecto multinacional que implica a la comunidad científica internacional."
9.2.ToK1,9,9.2,Theory of Knowledge,core,,Is energy just an abstract concept used to justify why certain types of changes are always associated with each other? Are concepts such as energy real?,,¿Es la energía simplemente un concepto abstracto usado para justificar por qué ciertos tipos de cambios siempre están asociados entre sí? ¿Son “reales” los conceptos como el de energía?
9.2.Uz1,9,9.2,Utilization,core,,Fuel cells.,,Pilas de combustible
9.2.Uz2,9,9.2,Utilization,core,,Heart pacemakers.,,Marcapasos cardíacos
9.2.Aims1,9,9.2,Aims,core,,Aim 6: Construction of a typical voltaic cell using two metal/metal-ion half-cells.,"Standard half-cell,Half-cells",Objetivo 6: Construcción de una pila voltaica típica con dos semiceldas de metal/ion metálico.
9.2.Aims2,9,9.2,Aims,core,,Aim 6: Electrolysis experiments could include that of a molten salt. A video could also be used to show some of these electrolytic processes.,Molten salts,Objetivo 6: Los experimentos de electrólisis podrían incluir sal fundida. También podría usarse un vídeo para mostrar estos procesos.
9.2.Aims3,9,9.2,Aims,core,,"Aim 8: Although the hydrogen fuel cell is considered an environmentally friendly, efficient alternative to the internal combustion engine, storage of hydrogen fuel is a major problem. The use of liquid methanol, which can be produced from plants as a carbon neutral fuel (one which does not contribute to the greenhouse effect), in fuel cells has enormous potential. What are the current barriers to the development of fuel cells?","Neutralization,Ampere,Current","Objetivo 8: Aunque la pila de combustible de hidrógeno se considera una alternativa eficiente y ecológica al motor de combustión interna, el almacenaje del combustible hidrógeno es un problema importante. El uso de metanol líquido, que se puede producir a partir de las plantas como combustible de carbono neutral (combustible que no contribuye al efecto invernadero), tiene un gran potencial en las pilas de combustible. ¿Cuáles son las barreras actuales para el desarrollo de las pilas de combustible?"
10.1.NoS1,10,10.1,Nature of Science,core,,Serendipity and scientific discoveries—PTFE and superglue. (1.4),,Casualidad y descubrimientos científicos: PTFE y pegamento extra fuerte. (1.4)
10.1.NoS2,10,10.1,Nature of Science,core,,"Ethical implications—drugs, additives and pesticides can have harmful effects on both people and the environment. (4.5)",,"Implicaciones éticas: drogas, aditivos y pesticidas pueden tener efectos nocivos sobre las personas y el ambiente. (4.5)"
10.1.U1,10,10.1,Understandings,core,,"A homologous series is a series of compounds of the same family, with the • same general formula, which differ from each other by a common structural.","Structural formula,Homologous series","Una serie homóloga es un conjunto de compuestos de la misma familia, que tienen la misma fórmula general, y que difieren entre sí en una unidad estructural común."
10.1.U2,10,10.1,Understandings,core,,Structural formulas can be represented in full and condensed format.,"Structural formula,Condensed structural formula",Las fórmulas estructurales se pueden representar de forma completa o condensada.
10.1.U3,10,10.1,Understandings,core,,Structural isomers are compounds with the same molecular formula but different arrangements of atoms.,"Structural formula,Structural isomers,Isomers",Los isómeros estructurales son compuestos con la misma fórmula molecular pero diferente distribución de átomos.
10.1.U4,10,10.1,Understandings,core,,Functional groups are the reactive parts of molecules.,"Hydrophilic,Hydrophobic,Functional groups",Los grupos funcionales son las partes reactivas de las moléculas.
10.1.U5,10,10.1,Understandings,core,,Saturated compounds contain single bonds only and unsaturated compounds contain double or triple bonds.,"Triple bond,Double bond,Unsaturated,Saturated",Los compuestos saturados contienen solo enlaces simples y los insaturados contienen enlaces dobles o triples.
10.1.U6,10,10.1,Understandings,core,,"Benzene is an aromatic, unsaturated hydrocarbon.","Aromatic,Aromatic compounds,Unsaturated,Hydrocarbon",El benceno es un hidrocarburo aromático insaturado.
10.1.AS1,10,10.1,Applications and skills,core,,Explanation of the trends in boiling points of members of a homologous series.,"Boiling point,Boiling,Trend,Homologous series",Explicación de las tendencias en cuanto a los puntos de ebullición de los miembros de una serie homóloga.
10.1.AS2,10,10.1,Applications and skills,core,,"Distinction between empirical, molecular and structural formulas.","Empirical formula,Molecular formula,Structural formula","Diferenciación entre fórmula empírica, molecular y estructural."
10.1.AS3,10,10.1,Applications and skills,core,,"Identification of different classes: alkanes, alkenes, alkynes, halogenoalkanes, alcohols, ethers, aldehydes, ketones, esters, carboxylic acids, amines, amides, nitriles and arenes.","Nitrile,Alkane,Alkene,Amide,Amine,Arene,Carboxylic acid,Halogenoalkane,Aldehyde,Ester","Identificación de diferentes clases: alcanos, alquenos, alquinos, haluros de alquilo, alcoholes, éteres, aldehídos, cetonas, ésteres, ácidos carboxílicos, aminas, amidas, nitrilos y arenos."
10.1.AS4,10,10.1,Applications and skills,core,,"Identification of typical functional groups in molecules eg phenyl, hydroxyl, carbonyl, carboxyl, carboxamide, aldehyde, ester, ether, amine, nitrile, alkyl, alkenyl and alkynyl.","Nitrile,Alkene,Carbonyl group,Carboxylic acid,Aldehyde,Functional groups,Electrophilic addition,Ester","Identificación de grupos funcionales típicos en moléculas, p. ej. fenilo, hidroxilo, carbonilo, carboxilo, carboxamida, aldehído, éster, éter, amina, nitrilo, alquilo, alquenilo y alquinilo."
10.1.AS5,10,10.1,Applications and skills,core,,Construction of 3-D models (real or virtual) of organic molecules.,,Construcción de modelos 3D (reales o virtuales) de moléculas orgánicas.
10.1.AS6,10,10.1,Applications and skills,core,,Application of IUPAC rules in the nomenclature of straight-chain and branched - chain isomers.,"Nomenclature,IUPAC",Aplicación de las reglas de la IUPAC a la nomenclatura de isómeros de cadena lineal y cadena ramificada.
10.1.AS7,10,10.1,Applications and skills,core,,"Identification of primary, secondary and tertiary carbon atoms in halogenoalkanes and alcohols and primary, secondary and tertiary nitrogen atoms in amines.","Tertiary carbon atom,Tertiary carbocation,Secondary carbon atom,Secondary carbocation,Primary carbon atom,Primary carbocation","Identificación de átomos de carbono primarios, secundarios y terciarios en haluros de alquilo y alcoholes, y átomos de nitrógeno primarios, secundarios y terciarios en aminas."
10.1.AS8,10,10.1,Applications and skills,core,,Discussion of the structure of benzene using physical and chemical evidence.,"Physical Evidence (Benzene),Chemical evidence (Benzene),Resonance energy for benzene,Delocalized pi electron cloud,Kekulé structure",Discusión de la estructura del benceno usando evidencias físicas y químicas.
10.1.G1,10,10.1,Guidance,core,,Skeletal formulas should be discussed in the course.,Skeletal formula,Las fórmulas estructurales se deben discutir durante el curso.
10.1.G2,10,10.1,Guidance,core,,"The general formulas (eg CnH2n+2) of alkanes, alkenes, alkynes, ketones, alcohols, aldehydes and carboxylic acids should be known.","Alkane,Carboxylic acid,Alcohol,Aldehyde","Deben saber las fórmulas generales (p. ej. CnH2n+2) de los alcanos, alquenos, alquinos, cetonas, alcoholes, aldehídos y ácidos carboxílicos."
10.1.G3,10,10.1,Guidance,core,,"The distinction between class names and functional group names needs to be made. Eg for OH, hydroxyl is the functional group whereas alcohol is the class name.","Alcohol,Functional groups","Es preciso que sepan diferenciar entre el nombre de la clase y el nombre del grupo funcional. Por ejemplo, OH es el grupo funcional hidroxilo, mientras que el nombre de la clase de compuestos es alcohol."
10.1.G4,10,10.1,Guidance,core,,"The following nomenclature should be covered: i. non-cyclic alkanes and halogenoalkanes up to halohexanes. ii. alkenes up to hexene and alkynes up to hexyne. iii. compounds up to six carbon atoms (in the basic chain for nomenclature purposes) containing only one of the classes of functional groups: alcohols, ethers, aldehydes, halogenoalkanes, ketones, esters and carboxylic acids.","Nomenclature,Alkane,Alkene,Carboxylic acid,Alcohol,Aldehyde,Functional groups","Se debe tratar la siguiente nomenclatura: i. Alcanos no cíclicos y haluros de alquilo hasta los halohexanos ii. Alquenos hasta el hexeno y alquinos hasta el hexino iii. Compuestos con un máximo de seis átomos de carbono (en la cadena básica para propósitos de nomenclatura) que contengan solo uno de los grupos funcionales: hidroxilo, éter, carbonilo (de aldehídos o cetonas), éster y carboxilo."
10.1.IM1,10,10.1,International-mindedness,core,,A small proportion of nations have control over the world’s oil resources. The interdependence of the countries that are net importers and those that are net exporters is an important factor in shaping global policies and economic developments.,,Una pequeña proporción de naciones tienen el control sobre las fuentes mundiales de petróleo. La interdependencia de los países que son importadores netos y aquellos que son exportadores netos es un importante factor que configura la política global y el desarrollo económico.
10.1.IM2,10,10.1,International-mindedness,core,,"The octane rating (octane number) can be described as a standard measure of the performance of the fuel used in cars and aircraft. Octane ratings often vary quite widely regionally throughout the globe, and are complicated by the fact that different countries use different means of expressing the values.",,"El grado de octano (número de octano) se puede describir como una medida estándar del rendimiento del combustible que se usa en vehículos y aviones. El grado de octano con frecuencia varía bastante entre las distintas regiones del mundo, y resulta complicado puesto que los distintos países usan diferentes maneras de expresar sus valores."
10.1.ToK1,10,10.1,Theory of Knowledge,core,,The label “organic chemistry” originates from a misconception that a vital force was needed to explain the chemistry of life. Can you think of examples where vocabulary has developed from similar misunderstandings? Can and should language ever be controlled to eliminate such problems?,,El nombre “química orgánica” tiene su origen en la idea equivocada de que era necesaria una fuerza vital para explicar la química de la vida. ¿Puede pensar ejemplos en los que el vocabulario se haya desarrollado a partir de una confusión similar? ¿Puede y debe controlarse el lenguaje para eliminar tales problemas?
10.1.ToK2,10,10.1,Theory of Knowledge,core,,Kekulé claimed that the inspiration for the cyclic structure of benzene came from a dream. What role do the less analytical ways of knowledge play in the acquisition of scientific knowledge?,Kekulé structure,Kekulé afirmó que la inspiración para la estructura cíclica del benceno provino de un sueño. ¿Qué papel desempeñan las formas menos analíticas de conocimiento en la adquisición del conocimiento científico?
10.1.Uz1,10,10.1,Utilization,core,,Fractional distillation makes great use of many petrochemicals.,,La destilación fraccionada utiliza muchos productos petroquímicos.
10.1.Uz2,10,10.1,Utilization,core,,"Dyes, pesticides, herbicides, explosives, soap, cosmetics, synthetic scents and flavourings.",Aromatic,"Pigmentos, pesticidas, herbicidas, explosivos, jabón, cosméticos, esencias sintéticas y aromatizantes."
10.1.Aims1,10,10.1,Aims,core,,Aim 6: Either use model kits or suitable computer-generated molecular graphics programmes to construct three-dimensional models of a wide range of organic molecules.,,Objetivo 6: Uso de modelos moleculares o bien programas gráficos moleculares informáticos adecuados para construir modelos tridimensionales de una gran variedad de moléculas orgánicas.
10.1.Aims2,10,10.1,Aims,core,,Aim 6: Experiments could include distillation to separate liquids or the use of a rotary evaporator to remove a solvent from a mixture.,Dehydration,Objetivo 6: Los experimentos podrían incluir la destilación para separar líquidos o bien el uso de un evaporador giratorio para eliminar el disolvente de una mezcla.
10.1.Aims3,10,10.1,Aims,core,,Aim 8: There are consequences in using fossil fuels as our main source of energy. Many products can be obtained from fossil fuels due to the inherently rich chemistry of carbon. This raises some fundamental questions—are fossil fuels too valuable to burn and how do they affect the environment? Who should be responsible for making decisions in this regard?,,Objetivo 8: El uso de combustibles fósiles como principal fuente de energía acarrea consecuencias. Se pueden obtener muchos productos de los combustibles fósiles debido a la riqueza inherente de la química del carbono. Esto conlleva a algunas preguntas fundamentales: ¿son los combustibles fósiles demasiado valiosos como para quemarlos y en qué medida afectan al ambiente? ¿Quién debe ser el responsable de tomar las decisiones en este aspecto?
10.1.Aims4,10,10.1,Aims,core,,Aim 8: Discuss the use of alcohols and biofuels as fuel alternatives to petrol (gasoline) and diesel.,Alcohol,Objetivo 8: Discutir el uso de alcoholes y biocombustibles como alternativa a la gasolina y al diesel.
10.2.NoS,10,10.2,Nature of Science,core,,Use of data—much of the progress that has been made to date in the developments and applications of scientific research can be mapped back to key organic chemical reactions involving functional group interconversions. (3.1),,"Uso de datos: Muchos de los progresos realizados hasta la fecha en cuanto a desarrollos y aplicaciones de la investigación científica, se han originado en reacciones químicas orgánicas claves que implican interconversiones de grupos funcionales. (3.1)"
10.2.U1,10,10.2,Understandings,core,,Alkanes have low reactivity and undergo free-radical substitution reactions.,"Alkane,Free radical,Initiation (free radical reaction)",Los alcanos tienen baja reactividad y sufren reacciones de sustitución por radicales libres.
10.2.U2,10,10.2,Understandings,core,,Alkenes are more reactive than alkanes and undergo addition reactions. Bromine water can be used to distinguish between alkenes and alkanes.,"Addition reaction,Alkene,Conjugation (electronic)",Los alquenos son más reactivos que los alcanos y sufren reacciones de adición. Se puede usar agua de bromo para diferenciar entre alquenos y alcanos.
10.2.U3,10,10.2,Understandings,core,,Alcohols undergo nucleophilic substitution reactions with acids (also called esterification or condensation) and some undergo oxidation reactions.,"Nucleophile,Nucleophilic substitution,Alcohol,Esterification,Condensation (a class of reaction)",Los alcoholes sufren reacciones de esterificación (o condensación) con los ácidos y algunos sufren reacciones de oxidación.
10.2.U4,10,10.2,Understandings,core,,Halogenoalkanes are more reactive than alkanes. They can undergo (nucleophilic) substitution reactions. A nucleophile is an electron-rich species containing a lone pair that it donates to an electron-deficient carbon.,"Nucleophile,Non-bonding pairs,Electron deficient,Termination,Substitution reaction,Nucleophilic substitution",Los haluros de alquilo son más reactivos que los alcanos. Pueden sufrir reacciones de sustitución (nucleófilas). Un nucleófilo es una especie rica en electrones que contiene un par electrónico solitario que dona a un átomo de carbono con déficit electrónico.
10.2.U5,10,10.2,Understandings,core,,Addition polymers consist of a wide range of monomers and form the basis of the plastics industry.,"Addition reaction,PVC,Monomer,Polymer,Polyethene",Los polímeros de adición están formados por una amplia variedad de monómeros y constituyen la base de la industria de los plásticos.
10.2.U6,10,10.2,Understandings,core,,Benzene does not readily undergo addition reactions but does undergo electrophilic substitution reactions.,"Electrophile,Addition reaction,Electrophilic substitution","El benceno no sufre reacciones de adición con facilidad, pero sí sufre reacciones de sustitución electrófila."
10.2.AS1,10,10.2,Applications and skills,core,,Alkanes: Writing equations for the complete and incomplete combustion of hydrocarbons.,"Alkane,Hydrocarbon,Aliphatics",Escritura de ecuaciones para la combustión completa e incompleta de hidrocarburos.
10.2.AS2,10,10.2,Applications and skills,core,,Alkanes: Explanation of the reaction of methane and ethane with halogens in terms of a free-radical substitution mechanism involving photochemical homolytic fission.,"Photochemical homolytic fission,Alkane,Heterolytic fission,Free radical,Homolytic fission","Explicación de las reacciones del metano y el etano con halógenos, por el mecanismo de sustitución por radicales libres en la que se produce la fisión homolítica fotoquímica."
10.2.AS3,10,10.2,Applications and skills,core,,Alkenes: Writing equations for the reactions of alkenes with hydrogen and halogens and of symmetrical alkenes with hydrogen halides and water.,"Halide ions,Symmetrical alkenes,Alkene,Hydrogenation,Aliphatics",Escritura de las ecuaciones de las reacciones de alquenos con hidrógeno y halógenos y de alquenos simétricos con haluros de hidrógeno y agua.
10.2.AS4,10,10.2,Applications and skills,core,,Alkenes: Outline of the addition polymerization of alkenes.,"Addition reaction,Addition polymerization,Polymer,Alkene,PVC,Polymerization,Aliphatics",Resumen de la polimerización por adición de los alquenos.
10.2.AS5,10,10.2,Applications and skills,core,,Alkenes: Relationship between the structure of the monomer to the polymer and repeating unit.,"Repeating unit,Alkene,Monomer,Polymer,Polymerization,Polyethene",Relación entre la estructura del monómero y la del polímero y la unidad que se repite.
